{
  "testRunId": "react-bootstrap-react-bootstrap-1767158982910",
  "repoOwner": "react-bootstrap",
  "repoName": "react-bootstrap",
  "assessedAt": "2025-12-31T05:40:41.313Z",
  "mode": "coverage-analysis",
  "model": "claude-sonnet-4-20250514",
  "tokensUsed": 8443,
  "analysis": "Looking at this react-bootstrap repository, I can see several significant gaps in what Buoy detected. This is a Bootstrap component library that should have extensive design tokens and patterns that Buoy missed.\n\n## Analysis of Missed Patterns\n\n### 1. Missed Design Tokens\n\nThe most glaring omission is that Buoy found **0 tokens** in a Bootstrap component library. Bootstrap has a comprehensive design token system that react-bootstrap clearly references throughout its components.\n\nFrom the Button component, I can see systematic references to Bootstrap's design tokens:\n- Color variants: `'primary', 'secondary', 'success', 'danger', 'warning', 'info', 'dark', 'light'`\n- Size tokens: `'sm', 'lg'`\n- CSS class patterns: `${prefix}-${variant}`, `${prefix}-${size}`\n\nThe Card component shows similar token patterns:\n- Background variants using `bg-${bg}` pattern\n- Text color variants using `text-${text}` pattern  \n- Border variants using `border-${border}` pattern\n\n### 2. Missed Token Usage Patterns\n\nBuoy should have detected the systematic way react-bootstrap applies Bootstrap's design tokens through CSS class generation. The `clsx()` calls show clear token application patterns that represent the bridge between design tokens and component implementation.\n\n### 3. Missed Type Definitions as Token Sources\n\nThe TypeScript type definitions like `ButtonVariant`, `Color`, and `Variant` are essentially token enumerations that Buoy should recognize as design token definitions. These types enforce the design system's constraints at the code level.\n\n### 4. Missed Theme Provider Integration\n\nThe `useBootstrapPrefix` hook from ThemeProvider suggests a theming system that Buoy should have detected as a token/theme management pattern.\n\n## Detection Improvements Needed\n\nBuoy needs better pattern recognition for:\n1. CSS-in-JS and CSS class-based design systems (not just JavaScript object tokens)\n2. TypeScript union types as token definitions\n3. Template literal patterns for applying tokens (`${prefix}-${variant}`)\n4. Theme provider patterns and prefix/namespace systems\n\n```json\n{\n  \"missedPatterns\": [\n    {\n      \"category\": \"token\",\n      \"description\": \"Bootstrap color variant tokens defined as TypeScript union types\",\n      \"evidence\": {\n        \"file\": \"src/Button.tsx\",\n        \"lineRange\": [25, 35],\n        \"codeSnippet\": \"/**\\n   * One or more button variant combinations\\n   *\\n   * buttons may be one of a variety of visual variants such as:\\n   *\\n   * `'primary', 'secondary', 'success', 'danger', 'warning', 'info', 'dark', 'light', 'link'`\\n   *\\n   * as well as \\\"outline\\\" versions (prefixed by 'outline-*')\\n   *\\n   * `'outline-primary', 'outline-secondary', 'outline-success', 'outline-danger', 'outline-warning', 'outline-info', 'outline-dark', 'outline-light'`\\n   */\\n  variant?: ButtonVariant | undefined;\"\n      },\n      \"suggestedDetection\": \"Parse TypeScript union types and JSDoc comments for design token enumerations\",\n      \"severity\": \"high\"\n    },\n    {\n      \"category\": \"token\",\n      \"description\": \"Size tokens defined as TypeScript literal types\",\n      \"evidence\": {\n        \"file\": \"src/Button.tsx\",\n        \"lineRange\": [40, 44],\n        \"codeSnippet\": \"/**\\n   * Specifies a large or small button.\\n   *\\n   * @type {'sm' | 'lg'}\\n   */\\n  size?: 'sm' | 'lg' | undefined;\"\n      },\n      \"suggestedDetection\": \"Detect TypeScript literal union types for size, spacing, and other design properties\",\n      \"severity\": \"medium\"\n    },\n    {\n      \"category\": \"token\",\n      \"description\": \"Color and variant tokens in Card component\",\n      \"evidence\": {\n        \"file\": \"src/Card.tsx\",\n        \"lineRange\": [25, 45],\n        \"codeSnippet\": \"/**\\n   * Sets card background\\n   *\\n   * @type {'primary' | 'secondary' | 'success' |'danger' | 'warning' | 'info' | 'dark' | 'light' | undefined}\\n   */\\n  bg?: Variant | undefined;\\n\\n  /**\\n   * Sets card text color\\n   *\\n   * @type {'primary' | 'secondary' | 'success' | 'danger' | 'warning' | 'info' | 'dark' | 'light' | 'white' | 'muted' | undefined}\\n   */\\n  text?: Color | undefined;\"\n      },\n      \"suggestedDetection\": \"Parse JSDoc @type annotations for token value enumerations\",\n      \"severity\": \"high\"\n    },\n    {\n      \"category\": \"token\",\n      \"description\": \"CSS class-based token application patterns\",\n      \"evidence\": {\n        \"file\": \"src/Card.tsx\",\n        \"lineRange\": [70, 78],\n        \"codeSnippet\": \"className={clsx(\\n          className,\\n          prefix,\\n          bg && `bg-${bg}`,\\n          text && `text-${text}`,\\n          border && `border-${border}`,\\n        )}\"\n      },\n      \"suggestedDetection\": \"Detect template literal patterns that apply design tokens as CSS classes\",\n      \"severity\": \"medium\"\n    },\n    {\n      \"category\": \"component\",\n      \"description\": \"Component composition pattern using Object.assign\",\n      \"evidence\": {\n        \"file\": \"src/Card.tsx\",\n        \"lineRange\": [82, 92],\n        \"codeSnippet\": \"export default Object.assign(Card, {\\n  Img: CardImg,\\n  Title: CardTitle,\\n  Subtitle: CardSubtitle,\\n  Body: CardBody,\\n  Link: CardLink,\\n  Text: CardText,\\n  Header: CardHeader,\\n  Footer: CardFooter,\\n  ImgOverlay: CardImgOverlay,\\n});\"\n      },\n      \"suggestedDetection\": \"Detect Object.assign patterns for compound component definitions\",\n      \"severity\": \"low\"\n    },\n    {\n      \"category\": \"source\",\n      \"description\": \"Theme provider system for design token management\",\n      \"evidence\": {\n        \"file\": \"src/Button.tsx\",\n        \"lineRange\": [65, 65],\n        \"codeSnippet\": \"const prefix = useBootstrapPrefix(bsPrefix, 'btn');\"\n      },\n      \"suggestedDetection\": \"Detect custom hooks that manage design system prefixes and theming\",\n      \"severity\": \"medium\"\n    }\n  ],\n  \"improvements\": [\n    {\n      \"area\": \"token-parser\",\n      \"title\": \"TypeScript Union Type Token Detection\",\n      \"description\": \"Parse TypeScript files to extract union types that represent design tokens, especially when combined with descriptive JSDoc comments\",\n      \"examples\": [\n        \"variant?: 'primary' | 'secondary' | 'success' | 'danger'\",\n        \"size?: 'sm' | 'lg'\"\n      ],\n      \"estimatedImpact\": \"Would catch 15+ color, size, and variant token sets\"\n    },\n    {\n      \"area\": \"token-parser\", \n      \"title\": \"JSDoc Type Annotation Parsing\",\n      \"description\": \"Extract design tokens from @type annotations in JSDoc comments, which often contain comprehensive token lists\",\n      \"examples\": [\n        \"@type {'primary' | 'secondary' | 'success' |'danger' | 'warning' | 'info' | 'dark' | 'light' | undefined}\"\n      ],\n      \"estimatedImpact\": \"Would catch detailed token enumerations with descriptions\"\n    },\n    {\n      \"area\": \"scanner\",\n      \"title\": \"CSS Class Template Literal Pattern Detection\",\n      \"description\": \"Detect template literals that apply design tokens as CSS classes, indicating token usage patterns\",\n      \"examples\": [\n        \"`bg-${bg}`\",\n        \"`${prefix}-${variant}`\",\n        \"`text-${text}`\"\n      ],\n      \"estimatedImpact\": \"Would detect token application patterns across all components\"\n    },\n    {\n      \"area\": \"scanner\",\n      \"title\": \"Theme Provider Hook Detection\",\n      \"description\": \"Detect custom hooks and providers that manage design system configuration and token application\",\n      \"examples\": [\n        \"useBootstrapPrefix(bsPrefix, 'btn')\",\n        \"ThemeProvider imports\"\n      ],\n      \"estimatedImpact\": \"Would identify theming infrastructure and token management systems\"\n    },\n    {\n      \"area\": \"config\",\n      \"title\": \"Framework-Specific Token Patterns\",\n      \"description\": \"Add configuration options for different design system approaches (CSS-based vs JS object-based tokens)\",\n      \"examples\": [\n        \"Bootstrap CSS class patterns\",\n        \"CSS-in-JS token objects\",\n        \"Design system provider patterns\"\n      ],\n      \"estimatedImpact\": \"Would dramatically improve detection for CSS-framework-based component libraries\"\n    }\n  ],\n  \"summary\": {\n    \"totalMissed\": 6,\n    \"missedByCategory\": {\n      \"component\": 1,\n      \"token\": 4,\n      \"drift\": 0,\n      \"source\": 1\n    },\n    \"improvementAreas\": [\n      \"token-parser\",\n      \"scanner\",\n      \"config\"\n    ]\n  }\n}\n```",
  "missedPatterns": [
    {
      "category": "token",
      "description": "Bootstrap color variant tokens defined as TypeScript union types",
      "evidence": {
        "file": "src/Button.tsx",
        "lineRange": [
          25,
          35
        ],
        "codeSnippet": "/**\n   * One or more button variant combinations\n   *\n   * buttons may be one of a variety of visual variants such as:\n   *\n   * `'primary', 'secondary', 'success', 'danger', 'warning', 'info', 'dark', 'light', 'link'`\n   *\n   * as well as \"outline\" versions (prefixed by 'outline-*')\n   *\n   * `'outline-primary', 'outline-secondary', 'outline-success', 'outline-danger', 'outline-warning', 'outline-info', 'outline-dark', 'outline-light'`\n   */\n  variant?: ButtonVariant | undefined;"
      },
      "suggestedDetection": "Parse TypeScript union types and JSDoc comments for design token enumerations",
      "severity": "high"
    },
    {
      "category": "token",
      "description": "Size tokens defined as TypeScript literal types",
      "evidence": {
        "file": "src/Button.tsx",
        "lineRange": [
          40,
          44
        ],
        "codeSnippet": "/**\n   * Specifies a large or small button.\n   *\n   * @type {'sm' | 'lg'}\n   */\n  size?: 'sm' | 'lg' | undefined;"
      },
      "suggestedDetection": "Detect TypeScript literal union types for size, spacing, and other design properties",
      "severity": "medium"
    },
    {
      "category": "token",
      "description": "Color and variant tokens in Card component",
      "evidence": {
        "file": "src/Card.tsx",
        "lineRange": [
          25,
          45
        ],
        "codeSnippet": "/**\n   * Sets card background\n   *\n   * @type {'primary' | 'secondary' | 'success' |'danger' | 'warning' | 'info' | 'dark' | 'light' | undefined}\n   */\n  bg?: Variant | undefined;\n\n  /**\n   * Sets card text color\n   *\n   * @type {'primary' | 'secondary' | 'success' | 'danger' | 'warning' | 'info' | 'dark' | 'light' | 'white' | 'muted' | undefined}\n   */\n  text?: Color | undefined;"
      },
      "suggestedDetection": "Parse JSDoc @type annotations for token value enumerations",
      "severity": "high"
    },
    {
      "category": "token",
      "description": "CSS class-based token application patterns",
      "evidence": {
        "file": "src/Card.tsx",
        "lineRange": [
          70,
          78
        ],
        "codeSnippet": "className={clsx(\n          className,\n          prefix,\n          bg && `bg-${bg}`,\n          text && `text-${text}`,\n          border && `border-${border}`,\n        )}"
      },
      "suggestedDetection": "Detect template literal patterns that apply design tokens as CSS classes",
      "severity": "medium"
    },
    {
      "category": "component",
      "description": "Component composition pattern using Object.assign",
      "evidence": {
        "file": "src/Card.tsx",
        "lineRange": [
          82,
          92
        ],
        "codeSnippet": "export default Object.assign(Card, {\n  Img: CardImg,\n  Title: CardTitle,\n  Subtitle: CardSubtitle,\n  Body: CardBody,\n  Link: CardLink,\n  Text: CardText,\n  Header: CardHeader,\n  Footer: CardFooter,\n  ImgOverlay: CardImgOverlay,\n});"
      },
      "suggestedDetection": "Detect Object.assign patterns for compound component definitions",
      "severity": "low"
    },
    {
      "category": "source",
      "description": "Theme provider system for design token management",
      "evidence": {
        "file": "src/Button.tsx",
        "lineRange": [
          65,
          65
        ],
        "codeSnippet": "const prefix = useBootstrapPrefix(bsPrefix, 'btn');"
      },
      "suggestedDetection": "Detect custom hooks that manage design system prefixes and theming",
      "severity": "medium"
    }
  ],
  "improvements": [
    {
      "area": "token-parser",
      "title": "TypeScript Union Type Token Detection",
      "description": "Parse TypeScript files to extract union types that represent design tokens, especially when combined with descriptive JSDoc comments",
      "examples": [
        "variant?: 'primary' | 'secondary' | 'success' | 'danger'",
        "size?: 'sm' | 'lg'"
      ],
      "estimatedImpact": "Would catch 15+ color, size, and variant token sets"
    },
    {
      "area": "token-parser",
      "title": "JSDoc Type Annotation Parsing",
      "description": "Extract design tokens from @type annotations in JSDoc comments, which often contain comprehensive token lists",
      "examples": [
        "@type {'primary' | 'secondary' | 'success' |'danger' | 'warning' | 'info' | 'dark' | 'light' | undefined}"
      ],
      "estimatedImpact": "Would catch detailed token enumerations with descriptions"
    },
    {
      "area": "scanner",
      "title": "CSS Class Template Literal Pattern Detection",
      "description": "Detect template literals that apply design tokens as CSS classes, indicating token usage patterns",
      "examples": [
        "`bg-${bg}`",
        "`${prefix}-${variant}`",
        "`text-${text}`"
      ],
      "estimatedImpact": "Would detect token application patterns across all components"
    },
    {
      "area": "scanner",
      "title": "Theme Provider Hook Detection",
      "description": "Detect custom hooks and providers that manage design system configuration and token application",
      "examples": [
        "useBootstrapPrefix(bsPrefix, 'btn')",
        "ThemeProvider imports"
      ],
      "estimatedImpact": "Would identify theming infrastructure and token management systems"
    },
    {
      "area": "config",
      "title": "Framework-Specific Token Patterns",
      "description": "Add configuration options for different design system approaches (CSS-based vs JS object-based tokens)",
      "examples": [
        "Bootstrap CSS class patterns",
        "CSS-in-JS token objects",
        "Design system provider patterns"
      ],
      "estimatedImpact": "Would dramatically improve detection for CSS-framework-based component libraries"
    }
  ],
  "summary": {
    "totalMissed": 6,
    "missedByCategory": {
      "component": 1,
      "token": 4,
      "drift": 0,
      "source": 1
    },
    "improvementAreas": [
      "token-parser",
      "scanner",
      "config"
    ]
  }
}