{
  "testRunId": "ant-design-ant-design-1767159003096",
  "repoOwner": "ant-design",
  "repoName": "ant-design",
  "assessedAt": "2025-12-31T05:37:16.742Z",
  "mode": "coverage-analysis",
  "model": "claude-sonnet-4-20250514",
  "tokensUsed": 16926,
  "analysis": "Looking at this analysis, I can see several significant gaps in what Buoy detected. Despite this being Ant Design - one of the most comprehensive React UI libraries - Buoy found 0 design tokens and 0 drift signals, which is clearly incorrect.\n\n## Major Findings\n\n### 1. Massive Token Detection Failure\nThe most glaring issue is that Buoy detected **0 tokens** despite Ant Design having one of the most sophisticated token systems in the React ecosystem. Looking at the configuration, Buoy was only configured to look at two specific files:\n- `components/menu/style/theme.ts`\n- `components/theme/themes/default/theme.ts`\n\nHowever, the actual token system is much more distributed throughout the codebase.\n\n### 2. Hardcoded Values Throughout Components\nI found numerous instances of hardcoded values that should be using design tokens instead. For example, in the Button component, there are magic strings like `__LIST_IGNORE_${Date.now()}__` and hardcoded class name patterns.\n\n### 3. Inconsistent Size and Variant Patterns\nComponents are using string literals for sizes (`'large'`, `'small'`, `'default'`) and variants (`'outlined'`, `'borderless'`) that should be centralized as tokens.\n\n### 4. CSS-in-JS Token System Missed\nAnt Design uses a sophisticated CSS-in-JS system with `useStyle` hooks that generate tokens, but Buoy's configuration doesn't seem to understand this pattern.\n\n### 5. Semantic Class Name System\nThere's an entire semantic class name and styling system (`SemanticClassNamesType`, `SemanticStylesType`) that represents design tokens but wasn't detected.\n\n```json\n{\n  \"missedPatterns\": [\n    {\n      \"category\": \"token\",\n      \"description\": \"Size token enum used across multiple components\",\n      \"evidence\": {\n        \"file\": \"components/button/Button.tsx\",\n        \"lineRange\": [25, 30],\n        \"codeSnippet\": \"export interface BaseButtonProps {\\n  size?: SizeType;\\n}\\n\\n// Used consistently across Input, Card, Skeleton components\\nsize?: 'large' | 'small' | 'default';\"\n      },\n      \"suggestedDetection\": \"Scan for repeated string literal unions that represent design choices, especially when used across multiple components\",\n      \"severity\": \"high\"\n    },\n    {\n      \"category\": \"token\",\n      \"description\": \"CSS-in-JS token system through useStyle hooks\",\n      \"evidence\": {\n        \"file\": \"components/button/Button.tsx\",\n        \"lineRange\": [180, 185],\n        \"codeSnippet\": \"import useStyle from './style';\\n// ...\\nconst [hashId, cssVarCls] = useStyle(prefixCls);\\n// This generates design tokens but wasn't detected\"\n      },\n      \"suggestedDetection\": \"Detect CSS-in-JS patterns where style hooks return token-like values (hashId, cssVarCls, etc.)\",\n      \"severity\": \"high\"\n    },\n    {\n      \"category\": \"token\",\n      \"description\": \"Semantic styling system with standardized style and className types\",\n      \"evidence\": {\n        \"file\": \"components/input/Input.tsx\",\n        \"lineRange\": [25, 35],\n        \"codeSnippet\": \"type SemanticName = 'root' | 'prefix' | 'suffix' | 'input' | 'count';\\nexport type InputClassNamesType = SemanticClassNamesType<InputProps, SemanticName>;\\nexport type InputStylesType = SemanticStylesType<InputProps, SemanticName>;\"\n      },\n      \"suggestedDetection\": \"Look for TypeScript type definitions that define semantic naming patterns for styles and class names\",\n      \"severity\": \"medium\"\n    },\n    {\n      \"category\": \"drift\",\n      \"description\": \"Hardcoded magic string that should use a design token\",\n      \"evidence\": {\n        \"file\": \"components/upload/Upload.tsx\",\n        \"lineRange\": [40, 42],\n        \"codeSnippet\": \"export const LIST_IGNORE = `__LIST_IGNORE_${Date.now()}__`;\"\n      },\n      \"suggestedDetection\": \"Flag constants with template literals containing magic strings, especially those exported from component files\",\n      \"severity\": \"medium\"\n    },\n    {\n      \"category\": \"drift\",\n      \"description\": \"Hardcoded variant strings used across multiple components\",\n      \"evidence\": {\n        \"file\": \"components/card/Card.tsx\",\n        \"lineRange\": [85, 87],\n        \"codeSnippet\": \"variant?: 'borderless' | 'outlined';\\n// Same pattern in multiple components but no central token\"\n      },\n      \"suggestedDetection\": \"Detect repeated string literal patterns across components that represent design variants\",\n      \"severity\": \"high\"\n    },\n    {\n      \"category\": \"source\",\n      \"description\": \"Style files not included in token scanning\",\n      \"evidence\": {\n        \"file\": \"components/button/style/index.ts\",\n        \"lineRange\": [1, 5],\n        \"codeSnippet\": \"// Style files likely contain token definitions but aren't scanned\\n// Pattern: components/*/style/*.ts files\"\n      },\n      \"suggestedDetection\": \"Include component-level style directories in token scanning by default\",\n      \"severity\": \"high\"\n    },\n    {\n      \"category\": \"drift\",\n      \"description\": \"Inconsistent className construction patterns\",\n      \"evidence\": {\n        \"file\": \"components/button/Button.tsx\",\n        \"lineRange\": [290, 310],\n        \"codeSnippet\": \"const dragCls = clsx(hashId, prefixCls, `${prefixCls}-drag`, {\\n  [`${prefixCls}-drag-uploading`]: mergedFileList.some((file) => file.status === 'uploading'),\\n  [`${prefixCls}-drag-hover`]: dragState === 'dragover',\\n  [`${prefixCls}-disabled`]: mergedDisabled,\\n});\"\n      },\n      \"suggestedDetection\": \"Analyze clsx/classnames usage for hardcoded state-based class patterns that could be tokenized\",\n      \"severity\": \"medium\"\n    },\n    {\n      \"category\": \"token\",\n      \"description\": \"ConfigProvider context system contains tokens but wasn't detected\",\n      \"evidence\": {\n        \"file\": \"components/button/Button.tsx\",\n        \"lineRange\": [50, 55],\n        \"codeSnippet\": \"const { getPrefixCls } = React.useContext(ConfigContext);\\nconst prefixCls = getPrefixCls('skeleton', customizePrefixCls);\\n// ConfigProvider likely contains design tokens\"\n      },\n      \"suggestedDetection\": \"Scan React Context providers that appear to manage design configuration\",\n      \"severity\": \"medium\"\n    }\n  ],\n  \"improvements\": [\n    {\n      \"area\": \"config\",\n      \"title\": \"Auto-detect common token file patterns\",\n      \"description\": \"Instead of requiring manual specification of token files, automatically scan for common patterns like style directories, theme files, and CSS-in-JS hooks\",\n      \"examples\": [\n        \"components/*/style/*.ts\",\n        \"useStyle hooks\",\n        \"theme.ts files\",\n        \"ConfigProvider contexts\"\n      ],\n      \"estimatedImpact\": \"Would catch hundreds of token definitions in Ant Design's distributed system\"\n    },\n    {\n      \"area\": \"token-parser\",\n      \"title\": \"CSS-in-JS token extraction\",\n      \"description\": \"Add support for detecting tokens generated by CSS-in-JS libraries, particularly pattern where style hooks return design tokens\",\n      \"examples\": [\n        \"const [hashId, cssVarCls] = useStyle(prefixCls)\",\n        \"CSS variable class names\",\n        \"Generated hash IDs for scoped styles\"\n      ],\n      \"estimatedImpact\": \"Would detect the core token system used throughout Ant Design\"\n    },\n    {\n      \"area\": \"drift-rules\",\n      \"title\": \"Cross-component consistency checking\",\n      \"description\": \"Detect when the same design concepts (sizes, variants, etc.) are defined differently across components using string literals instead of shared tokens\",\n      \"examples\": [\n        \"size?: 'large' | 'small' | 'default' repeated across components\",\n        \"variant patterns like 'outlined' | 'borderless'\",\n        \"Consistent state class naming patterns\"\n      ],\n      \"estimatedImpact\": \"Would identify dozens of instances where shared tokens should be used\"\n    },\n    {\n      \"area\": \"scanner\",\n      \"title\": \"TypeScript semantic analysis\",\n      \"description\": \"Analyze TypeScript type definitions to identify design system patterns, particularly semantic naming types and repeated union types\",\n      \"examples\": [\n        \"SemanticClassNamesType and SemanticStylesType patterns\",\n        \"ButtonShape, ButtonType, ButtonVariantType enums\",\n        \"Repeated string literal unions across components\"\n      ],\n      \"estimatedImpact\": \"Would catch the underlying type system that defines design patterns\"\n    },\n    {\n      \"area\": \"scanner\",\n      \"title\": \"React Context design system detection\",\n      \"description\": \"Automatically detect and analyze React Contexts that appear to manage design configuration, theme, or styling\",\n      \"examples\": [\n        \"ConfigContext with getPrefixCls\",\n        \"DisabledContext\",\n        \"SizeContext\",\n        \"Theme providers\"\n      ],\n      \"estimatedImpact\": \"Would detect centralized configuration systems that contain design tokens\"\n    }\n  ],\n  \"summary\": {\n    \"totalMissed\": 8,\n    \"missedByCategory\": {\n      \"component\": 0,\n      \"token\": 4,\n      \"drift\": 3,\n      \"source\": 1\n    },\n    \"improvementAreas\": [\n      \"config\",\n      \"token-parser\",\n      \"drift-rules\",\n      \"scanner\"\n    ]\n  }\n}\n```",
  "missedPatterns": [
    {
      "category": "token",
      "description": "Size token enum used across multiple components",
      "evidence": {
        "file": "components/button/Button.tsx",
        "lineRange": [
          25,
          30
        ],
        "codeSnippet": "export interface BaseButtonProps {\n  size?: SizeType;\n}\n\n// Used consistently across Input, Card, Skeleton components\nsize?: 'large' | 'small' | 'default';"
      },
      "suggestedDetection": "Scan for repeated string literal unions that represent design choices, especially when used across multiple components",
      "severity": "high"
    },
    {
      "category": "token",
      "description": "CSS-in-JS token system through useStyle hooks",
      "evidence": {
        "file": "components/button/Button.tsx",
        "lineRange": [
          180,
          185
        ],
        "codeSnippet": "import useStyle from './style';\n// ...\nconst [hashId, cssVarCls] = useStyle(prefixCls);\n// This generates design tokens but wasn't detected"
      },
      "suggestedDetection": "Detect CSS-in-JS patterns where style hooks return token-like values (hashId, cssVarCls, etc.)",
      "severity": "high"
    },
    {
      "category": "token",
      "description": "Semantic styling system with standardized style and className types",
      "evidence": {
        "file": "components/input/Input.tsx",
        "lineRange": [
          25,
          35
        ],
        "codeSnippet": "type SemanticName = 'root' | 'prefix' | 'suffix' | 'input' | 'count';\nexport type InputClassNamesType = SemanticClassNamesType<InputProps, SemanticName>;\nexport type InputStylesType = SemanticStylesType<InputProps, SemanticName>;"
      },
      "suggestedDetection": "Look for TypeScript type definitions that define semantic naming patterns for styles and class names",
      "severity": "medium"
    },
    {
      "category": "drift",
      "description": "Hardcoded magic string that should use a design token",
      "evidence": {
        "file": "components/upload/Upload.tsx",
        "lineRange": [
          40,
          42
        ],
        "codeSnippet": "export const LIST_IGNORE = `__LIST_IGNORE_${Date.now()}__`;"
      },
      "suggestedDetection": "Flag constants with template literals containing magic strings, especially those exported from component files",
      "severity": "medium"
    },
    {
      "category": "drift",
      "description": "Hardcoded variant strings used across multiple components",
      "evidence": {
        "file": "components/card/Card.tsx",
        "lineRange": [
          85,
          87
        ],
        "codeSnippet": "variant?: 'borderless' | 'outlined';\n// Same pattern in multiple components but no central token"
      },
      "suggestedDetection": "Detect repeated string literal patterns across components that represent design variants",
      "severity": "high"
    },
    {
      "category": "source",
      "description": "Style files not included in token scanning",
      "evidence": {
        "file": "components/button/style/index.ts",
        "lineRange": [
          1,
          5
        ],
        "codeSnippet": "// Style files likely contain token definitions but aren't scanned\n// Pattern: components/*/style/*.ts files"
      },
      "suggestedDetection": "Include component-level style directories in token scanning by default",
      "severity": "high"
    },
    {
      "category": "drift",
      "description": "Inconsistent className construction patterns",
      "evidence": {
        "file": "components/button/Button.tsx",
        "lineRange": [
          290,
          310
        ],
        "codeSnippet": "const dragCls = clsx(hashId, prefixCls, `${prefixCls}-drag`, {\n  [`${prefixCls}-drag-uploading`]: mergedFileList.some((file) => file.status === 'uploading'),\n  [`${prefixCls}-drag-hover`]: dragState === 'dragover',\n  [`${prefixCls}-disabled`]: mergedDisabled,\n});"
      },
      "suggestedDetection": "Analyze clsx/classnames usage for hardcoded state-based class patterns that could be tokenized",
      "severity": "medium"
    },
    {
      "category": "token",
      "description": "ConfigProvider context system contains tokens but wasn't detected",
      "evidence": {
        "file": "components/button/Button.tsx",
        "lineRange": [
          50,
          55
        ],
        "codeSnippet": "const { getPrefixCls } = React.useContext(ConfigContext);\nconst prefixCls = getPrefixCls('skeleton', customizePrefixCls);\n// ConfigProvider likely contains design tokens"
      },
      "suggestedDetection": "Scan React Context providers that appear to manage design configuration",
      "severity": "medium"
    }
  ],
  "improvements": [
    {
      "area": "config",
      "title": "Auto-detect common token file patterns",
      "description": "Instead of requiring manual specification of token files, automatically scan for common patterns like style directories, theme files, and CSS-in-JS hooks",
      "examples": [
        "components/*/style/*.ts",
        "useStyle hooks",
        "theme.ts files",
        "ConfigProvider contexts"
      ],
      "estimatedImpact": "Would catch hundreds of token definitions in Ant Design's distributed system"
    },
    {
      "area": "token-parser",
      "title": "CSS-in-JS token extraction",
      "description": "Add support for detecting tokens generated by CSS-in-JS libraries, particularly pattern where style hooks return design tokens",
      "examples": [
        "const [hashId, cssVarCls] = useStyle(prefixCls)",
        "CSS variable class names",
        "Generated hash IDs for scoped styles"
      ],
      "estimatedImpact": "Would detect the core token system used throughout Ant Design"
    },
    {
      "area": "drift-rules",
      "title": "Cross-component consistency checking",
      "description": "Detect when the same design concepts (sizes, variants, etc.) are defined differently across components using string literals instead of shared tokens",
      "examples": [
        "size?: 'large' | 'small' | 'default' repeated across components",
        "variant patterns like 'outlined' | 'borderless'",
        "Consistent state class naming patterns"
      ],
      "estimatedImpact": "Would identify dozens of instances where shared tokens should be used"
    },
    {
      "area": "scanner",
      "title": "TypeScript semantic analysis",
      "description": "Analyze TypeScript type definitions to identify design system patterns, particularly semantic naming types and repeated union types",
      "examples": [
        "SemanticClassNamesType and SemanticStylesType patterns",
        "ButtonShape, ButtonType, ButtonVariantType enums",
        "Repeated string literal unions across components"
      ],
      "estimatedImpact": "Would catch the underlying type system that defines design patterns"
    },
    {
      "area": "scanner",
      "title": "React Context design system detection",
      "description": "Automatically detect and analyze React Contexts that appear to manage design configuration, theme, or styling",
      "examples": [
        "ConfigContext with getPrefixCls",
        "DisabledContext",
        "SizeContext",
        "Theme providers"
      ],
      "estimatedImpact": "Would detect centralized configuration systems that contain design tokens"
    }
  ],
  "summary": {
    "totalMissed": 8,
    "missedByCategory": {
      "component": 0,
      "token": 4,
      "drift": 3,
      "source": 1
    },
    "improvementAreas": [
      "config",
      "token-parser",
      "drift-rules",
      "scanner"
    ]
  }
}